{
  "schema_version": "gpu_femm_magnetostatic_mesh_v1",
  "source_fem_sha256": "f36acb1c6c20be5b1a9c319e6cfae11800a054aac05417696b44bde116842e5d",
  "canonical_identity_sha256": "92d7b1bf065e0b89535f27c68301ece53ae6c184c435902b69de06cb7156e045",
  "resolved": {
    "source_fem_sha256": "f36acb1c6c20be5b1a9c319e6cfae11800a054aac05417696b44bde116842e5d",
    "model": {
      "depth_mm": 1.0,
      "problem_type": "axisymmetric",
      "frequency_hz": 0
    },
    "nodes_mm": [
      [
        0.0,
        0.0
      ],
      [
        10.0,
        0.0
      ],
      [
        10.0,
        10.0
      ],
      [
        0.0,
        10.0
      ],
      [
        1.0,
        0.0
      ],
      [
        2.0,
        0.0
      ],
      [
        3.0,
        0.0
      ],
      [
        4.0,
        0.0
      ],
      [
        5.0,
        0.0
      ],
      [
        6.0,
        0.0
      ],
      [
        7.0,
        0.0
      ],
      [
        8.0,
        0.0
      ],
      [
        9.0,
        0.0
      ],
      [
        10.0,
        1.0
      ],
      [
        10.0,
        2.0
      ],
      [
        10.0,
        3.0
      ],
      [
        10.0,
        4.0
      ],
      [
        10.0,
        5.0
      ],
      [
        10.0,
        6.0
      ],
      [
        10.0,
        7.0
      ],
      [
        10.0,
        8.0
      ],
      [
        10.0,
        9.0
      ],
      [
        9.0,
        10.0
      ],
      [
        8.0,
        10.0
      ],
      [
        7.0,
        10.0
      ],
      [
        6.0,
        10.0
      ],
      [
        5.0,
        10.0
      ],
      [
        4.0,
        10.0
      ],
      [
        3.0,
        10.0
      ],
      [
        2.0,
        10.0
      ],
      [
        1.0,
        10.0
      ],
      [
        0.0,
        9.0
      ],
      [
        0.0,
        8.0
      ],
      [
        0.0,
        7.0
      ],
      [
        0.0,
        6.0
      ],
      [
        0.0,
        5.0
      ],
      [
        0.0,
        4.0
      ],
      [
        0.0,
        3.0
      ],
      [
        0.0,
        2.0
      ],
      [
        0.0,
        1.0
      ],
      [
        1.6035731257308419,
        2.5
      ],
      [
        1.6035731257308419,
        7.5
      ],
      [
        6.5,
        1.6035731257308419
      ],
      [
        8.5,
        1.5
      ],
      [
        7.5,
        8.396426874269158
      ],
      [
        1.0356393220460105,
        3.5
      ],
      [
        0.7238356431385576,
        2.5
      ],
      [
        0.8799912316793375,
        1.5
      ],
      [
        2.5,
        1.3607162281823948
      ],
      [
        3.5,
        8.396426874269158
      ],
      [
        1.5,
        8.797854521525268
      ],
      [
        0.7238356431385576,
        7.5
      ],
      [
        0.8799912316793375,
        6.5
      ],
      [
        0.7761776863504641,
        8.349712111300763
      ],
      [
        0.7833883203656589,
        9.14668190225341
      ],
      [
        6.5,
        0.7238356431385576
      ],
      [
        7.5,
        0.8799912316793375
      ],
      [
        5.363092205072303,
        1.1637043844346997
      ],
      [
        8.396426874269158,
        4.5
      ],
      [
        9.0,
        2.5
      ],
      [
        8.396426874269158,
        6.5
      ],
      [
        8.797854521525268,
        8.5
      ],
      [
        7.5,
        9.276164356861443
      ],
      [
        6.5,
        9.120008768320663
      ],
      [
        8.349712111300763,
        9.223822313649537
      ],
      [
        9.146681902253409,
        9.21661167963434
      ],
      [
        0.8799148345233214,
        4.5
      ],
      [
        1.5,
        0.794803624264835
      ],
      [
        3.5,
        0.9559482718575336
      ],
      [
        4.5,
        8.964360677953989
      ],
      [
        3.5,
        9.276164356861443
      ],
      [
        2.5,
        9.120008768320663
      ],
      [
        7.52125178982596,
        1.9621592280910947
      ],
      [
        4.5,
        0.7945042029326806
      ],
      [
        4.339506613464565,
        2.363135758765408
      ],
      [
        9.276164356861443,
        4.5
      ],
      [
        9.120008768320663,
        5.5
      ],
      [
        8.836295615565302,
        3.541671346021577
      ],
      [
        9.276164356861443,
        6.5
      ],
      [
        9.120008768320663,
        7.5
      ],
      [
        5.5,
        9.13386377445861
      ],
      [
        0.8661359256555271,
        5.500000527793857
      ],
      [
        4.91072338478309,
        7.076820650380732
      ],
      [
        6.435606857907509,
        3.420518101680399
      ],
      [
        2.5613502040155076,
        4.249715603209592
      ],
      [
        3.3423130089007222,
        2.00403409857733
      ],
      [
        8.024463533393074,
        2.880388271268699
      ],
      [
        5.9827603027686616,
        7.882642543931821
      ],
      [
        4.411090730050337,
        7.956558132973016
      ],
      [
        6.751068492890497,
        2.522084623006045
      ],
      [
        5.534935500440463,
        2.5996708649193927
      ],
      [
        1.6816127214232237,
        4.112718934578408
      ],
      [
        1.8420406587163427,
        3.296708175747754
      ],
      [
        2.58379727820916,
        2.640645858536943
      ],
      [
        1.9612134643517076,
        5.210393867367678
      ],
      [
        3.5423741655626673,
        3.0125920582698784
      ],
      [
        3.250183672633624,
        6.715491893809876
      ],
      [
        4.709675892698206,
        3.6313977750921573
      ],
      [
        4.024121710911433,
        7.155037467705368
      ],
      [
        3.2763007357459126,
        7.570641468836373
      ],
      [
        4.341996161605278,
        5.694198441594484
      ],
      [
        2.5949337638199235,
        8.198410784233749
      ],
      [
        2.4554604676526703,
        7.167737086606831
      ],
      [
        1.7545767802689605,
        6.628951110941028
      ],
      [
        2.520575811987629,
        6.357763483431968
      ],
      [
        3.3053029353418912,
        5.680169958077481
      ],
      [
        2.7717770860297155,
        5.048961665409788
      ],
      [
        3.7568896178351823,
        4.362275731295238
      ],
      [
        9.125,
        0.875
      ],
      [
        1.7098524488488442,
        1.6613128273801827
      ],
      [
        8.063480522263678,
        7.502699330701246
      ],
      [
        6.977431372092111,
        7.442459571751302
      ],
      [
        6.046240893897863,
        6.682179285446459
      ],
      [
        6.68111207814702,
        8.317510384480189
      ],
      [
        5.21505942152707,
        8.305182152485765
      ],
      [
        5.046349981322264,
        1.9298747429234164
      ],
      [
        4.339960397197204,
        1.5706560278639203
      ],
      [
        5.565842278403584,
        3.470311172227824
      ],
      [
        6.080571397933017,
        4.840145742359193
      ],
      [
        5.2892232554126695,
        4.355878160102965
      ],
      [
        5.239835303247437,
        5.325293764940617
      ],
      [
        6.051572494421319,
        5.7609419667678985
      ],
      [
        7.336979536828299,
        5.340568917239322
      ],
      [
        5.283968912074039,
        6.217133598894225
      ],
      [
        6.915292569620168,
        6.226574777502767
      ],
      [
        7.578031693242314,
        6.784878938065829
      ],
      [
        7.767428112357048,
        6.010998546520157
      ],
      [
        8.15768463549436,
        5.287035470794981
      ],
      [
        3.210790737040848,
        3.757182244450489
      ],
      [
        7.015685988077072,
        4.319799738800536
      ],
      [
        7.339984386478792,
        3.4738819178203872
      ]
    ],
    "triangles": {
      "node_indices": [
        [
          8,
          9,
          57
        ],
        [
          39,
          0,
          4
        ],
        [
          41,
          51,
          52
        ],
        [
          47,
          46,
          38
        ],
        [
          46,
          37,
          38
        ],
        [
          68,
          85,
          48
        ],
        [
          40,
          46,
          47
        ],
        [
          57,
          9,
          55
        ],
        [
          67,
          47,
          39
        ],
        [
          77,
          15,
          16
        ],
        [
          47,
          109,
          40
        ],
        [
          17,
          76,
          75
        ],
        [
          6,
          68,
          48
        ],
        [
          46,
          45,
          37
        ],
        [
          111,
          110,
          44
        ],
        [
          48,
          5,
          6
        ],
        [
          43,
          86,
          72
        ],
        [
          36,
          37,
          45
        ],
        [
          68,
          116,
          85
        ],
        [
          66,
          36,
          45
        ],
        [
          42,
          55,
          56
        ],
        [
          33,
          51,
          32
        ],
        [
          53,
          51,
          41
        ],
        [
          62,
          63,
          44
        ],
        [
          52,
          51,
          33
        ],
        [
          59,
          14,
          15
        ],
        [
          45,
          92,
          91
        ],
        [
          3,
          31,
          54
        ],
        [
          47,
          38,
          39
        ],
        [
          50,
          29,
          30
        ],
        [
          70,